[
{
    "_id" : "srxdriverpr1external07_rc_srx_qa_driverpr1_007_InteriorRecorder_1645513203385_1645514871743",
    "data_status" : "complete",
    "from_container" : "Metadata",
    "info_source" : "SDM",
    "last_updated" : "2022-01-27T17:08:15.860010Z",
    "processing_list" : [ 
        "Anonymize", 
        "CHC"
    ],
    "s3_path" : "Debug_Lync/srxdriverpr1external07_rc_srx_qa_driverpr1_007_InteriorRecorder_1645513203385_1645514871743.mp4"
},
{
    "_id" : "srxdriverpr1external07_rc_srx_qa_driverpr1_007_InteriorRecorder_1645517710980_1645519350202",
    "data_status" : "complete",
    "from_container" : "Metadata",
    "info_source" : "SDM",
    "last_updated" : "2022-01-27T17:08:15.860010Z",
    "processing_list" : [ 
        "Anonymize", 
        "CHC"
    ],
    "s3_path" : "Debug_Lync/srxdriverpr1external07_rc_srx_qa_driverpr1_007_InteriorRecorder_1645517710980_1645519350202.mp4"
}
]